{
  "$schema": "./shader-map.schema.json",
  "generated": "2026-09-02",
  "method": "static: tools/shader_dump/match_enb.py --match-decls. Candidates are first restricted to shaders with a compatible declaration signature (identical input declarations, samplers a subset of the ENB file's), then ranked by normalised-assembly similarity. declaration_matched_pool records how many candidates survived that filter -- a pool of 1 with a high similarity is an identification, a large pool with a low one is a lead.",
  "note": "Confidence is about identification, not about anything working. Similarity is symmetric: matched instruction lines over combined length, with def/dcl excluded because that is precisely what ENB and FusionFix both edit. A similarity of 1.000 means the game shader's whole instruction body appears verbatim inside the ENB replacement file. A combined magenta probe has runtime-confirmed substitution for at least one terrain row, but did not isolate which row. Supersedes the 2026-09-01 version, which was produced with a shader extractor that missed about nine blobs in ten.",
  "shader_sets": {
    "ce-vanilla": "Grand Theft Auto IV/GTAIV/common/shaders/win32_30 (CE 1.2.0.59, 102 containers, 1689 shaders)",
    "ce-fusionfix": "Grand Theft Auto IV/GTAIV/update/common/shaders/win32_30 (FusionFix 5.0.1, 103 containers, 1739 shaders)",
    "old-reference": "Steam 1.0.8.0 main depot 12211 manifest 4406763129603688303 downloaded September 5; executable version verified and all six shader variants compared. The mapped candidate containers are byte-identical to stock CE. See steam1080-reference.md. No 1.0.4.0 executable/shader set is available."
  },
  "presets": {
    "enbseries-0.163": "ENB resources/enbseries_gta4_v0163.zip -- 4 pixel shader replacements",
    "icenhancer-4.0": "ENB resources/icenhancer40.zip -- 10 pixel + 2 vertex shader replacements"
  },
  "headline": "Static candidate map, not raw hash equality. September 4 recovered ENB 0.163 hashing: none of the twelve preset filenames matches stock CE on disk. Three normalized terrain bodies match; a combined runtime probe confirmed that at least one recovered CE terrain filename triggers substitution. Postfx AA1C0C36 is already recognized as one of six aliases. See legacy-shader-bridge.md, contracts/ce-shader-aliases.json and evidence/2026-09-04/user-terrain-probe.json.",
  "container_spread": "Nine identified containers account for 191 of 1739 modern FusionFix blobs. Retaining 89 percent of blobs is not evidence of retaining 89 percent of rendering features; mixed depth and binding interfaces remain untested.",
  "entries": [
    {
      "enb_hash": "0CBF49C5",
      "stage": "ps",
      "preset": "icenhancer-4.0",
      "role": "two-layer terrain blend, writes the full GBuffer (oC0..oC3)",
      "enb_instructions": 20,
      "ce_vanilla": {
        "candidate": "gta_terrain_va_2lyr.fxc#5",
        "similarity": 1.0,
        "confidence": "high",
        "declaration_matched_pool": 1
      },
      "ce_fusionfix": {
        "candidate": "gta_terrain_va_2lyr.fxc#5",
        "similarity": 0.632,
        "confidence": "medium"
      },
      "notes": "Exact. Verified line by line against the CE disassembly: twelve instructions, identical declarations, differing only in the .w component of one def. The CE shader is 20 instructions, the FusionFix rewrite is 42."
    },
    {
      "enb_hash": "405ABC1B",
      "stage": "ps",
      "preset": "icenhancer-4.0",
      "role": "three-layer terrain blend",
      "enb_instructions": 25,
      "ce_vanilla": {
        "candidate": "gta_terrain_va_3lyr.fxc#7",
        "similarity": 1.0,
        "confidence": "high",
        "declaration_matched_pool": 1
      },
      "ce_fusionfix": {
        "candidate": "gta_terrain_va_3lyr.fxc#7",
        "similarity": 0.687,
        "confidence": "medium"
      },
      "notes": "Exact. Same body as 0CBF49C5 with one more blend layer."
    },
    {
      "enb_hash": "841FD9AE",
      "stage": "ps",
      "preset": "icenhancer-4.0",
      "role": "four-layer terrain blend",
      "enb_instructions": 30,
      "ce_vanilla": {
        "candidate": "gta_terrain_va_4lyr.fxc#9",
        "similarity": 1.0,
        "confidence": "high",
        "declaration_matched_pool": 1
      },
      "ce_fusionfix": {
        "candidate": "gta_terrain_va_4lyr.fxc#9",
        "similarity": 0.727,
        "confidence": "medium"
      },
      "notes": "Exact. Third member of the terrain family."
    },
    {
      "enb_hash": "54F25463",
      "stage": "vs",
      "preset": "icenhancer-4.0",
      "role": "light-shaft geometry vertex shader (named lightShafts technique)",
      "enb_instructions": 99,
      "ce_vanilla": {
        "candidate": "deferred_lighting.fxc#7",
        "similarity": 0.995,
        "confidence": "high",
        "declaration_matched_pool": 3
      },
      "ce_fusionfix": {
        "candidate": "deferred_lighting.fxc#3",
        "similarity": 0.923,
        "confidence": "medium"
      },
      "notes": "Reads c208..c222 -- vertex registers, which do not overlap FusionFix's vertex range of c227..c237."
    },
    {
      "enb_hash": "C35A5E05",
      "stage": "vs",
      "preset": "icenhancer-4.0",
      "role": "light-shaft geometry vertex shader, texture-sampling variant (named lightShafts technique)",
      "enb_instructions": 129,
      "ce_vanilla": {
        "candidate": "deferred_lighting.fxc#8",
        "similarity": 0.988,
        "confidence": "high",
        "declaration_matched_pool": 4
      },
      "ce_fusionfix": {
        "candidate": "deferred_lighting.fxc#8",
        "similarity": 0.879,
        "confidence": "medium"
      },
      "notes": "Same family as 54F25463; declares s0 and reads c215..c222."
    },
    {
      "enb_hash": "22DCDB69",
      "stage": "ps",
      "preset": "icenhancer-4.0",
      "role": "post-process pass reconstructing view depth (depth of field / motion blur)",
      "enb_instructions": 88,
      "ce_vanilla": {
        "candidate": "rage_postfx.fxc#12",
        "similarity": 0.912,
        "confidence": "high",
        "declaration_matched_pool": 79
      },
      "ce_fusionfix": {
        "candidate": "rage_postfx.fxc#24",
        "similarity": 0.785,
        "confidence": "medium"
      },
      "notes": "Lives in the same container as the shader enbeffect.fx replaces, and is the reason the post-process interface in contracts/enb-postfx.json matters. Reconstructs depth from c73 and offsets sampling by c72."
    },
    {
      "enb_hash": "71CC11CF",
      "stage": "ps",
      "preset": "icenhancer-4.0",
      "role": "vegetation / grass, stipple-faded",
      "enb_instructions": 35,
      "ce_vanilla": {
        "candidate": "gta_grass.fxc#2",
        "similarity": 0.817,
        "confidence": "high",
        "declaration_matched_pool": 1
      },
      "ce_fusionfix": {
        "candidate": "gta_grass.fxc#2",
        "similarity": 0.479,
        "confidence": "low"
      },
      "notes": "The largest stock-versus-FusionFix gap of any entry."
    },
    {
      "enb_hash": "2DF967C6",
      "stage": "ps",
      "preset": "enbseries-0.163, icenhancer-4.0",
      "role": "alpha-faded surface using the stipple texture",
      "enb_instructions": 51,
      "ce_vanilla": {
        "candidate": "gta_default.fxc#15 (= gta_cutout_fence.fxc#15 = gta_wire.fxc#14, same bytecode)",
        "similarity": 0.667,
        "confidence": "medium",
        "declaration_matched_pool": 11
      },
      "ce_fusionfix": {
        "candidate": "gta_cutout_fence.fxc#15",
        "similarity": 0.43,
        "confidence": "low"
      },
      "notes": "Present in both presets with different contents, which is what shows the hash names the shader being replaced rather than the replacement. Parameter block lists StippleTexture, TextureSampler, globalScalars and stencil."
    },
    {
      "enb_hash": "323E9BB8",
      "stage": "ps",
      "preset": "enbseries-0.163, icenhancer-4.0",
      "role": "alpha-faded surface, detail-mapped variant",
      "enb_instructions": 51,
      "ce_vanilla": {
        "candidate": "",
        "similarity": 0.345,
        "confidence": "none",
        "declaration_matched_pool": 11
      },
      "ce_fusionfix": {
        "candidate": "gta_cutout_fence.fxc#15",
        "similarity": 0.38,
        "confidence": "low"
      },
      "notes": "UNRESOLVED. Shares its declaration signature with 2DF967C6 (s0, s10 plus ENB's s13; texcoord/texcoord1/color/vPos) and so draws the same 11-candidate pool, but matches none of them well -- best 0.345 against 2DF967C6's 0.667 on the identical pool. Most likely a variant of the same surface shader that Complete Edition compiles differently, or one that is absent here."
    },
    {
      "enb_hash": "F5256B40",
      "stage": "ps",
      "preset": "enbseries-0.163, icenhancer-4.0",
      "role": "normal-mapped surface with detail map",
      "enb_instructions": 67,
      "ce_vanilla": {
        "candidate": "",
        "similarity": 0.375,
        "confidence": "none",
        "declaration_matched_pool": 16
      },
      "ce_fusionfix": {
        "candidate": "gta_glass_spec.fxc#15",
        "similarity": 0.404,
        "confidence": "none"
      },
      "notes": "UNRESOLVED. Declaration signature s0, s1, s10 (plus ENB s13) narrows it to 16 candidates in the gta_spec / gta_glass_spec family; best similarity 0.375, which is a lead rather than an identification."
    },
    {
      "enb_hash": "46A43A9F",
      "stage": "ps",
      "preset": "icenhancer-4.0",
      "role": "distorted alpha-tested sprite (texkill on alpha)",
      "enb_instructions": 16,
      "ce_vanilla": {
        "candidate": "",
        "similarity": 0.0,
        "confidence": "none",
        "declaration_matched_pool": 0
      },
      "ce_fusionfix": {
        "candidate": "cascadeConvert.fxc#2",
        "similarity": 0.273,
        "confidence": "none"
      },